<?xml version="1.0" encoding="UTF-8" standalone="no" ?>
<tns:RSpec xmlns:tns="http://yuba.stanford.edu/geniLight/rspec" xmlns:xsi="http://www.w3.org/2001/XMLSchema-instance" xsi:schemaLocation="http://yuba.stanford.edu/geniLight/rspec http://yuba.stanford.edu/geniLight/rspec.xsd">

  <tns:version>1.0</tns:version>

  <tns:switchEntry>
    <tns:node>
      <tns:nodeId>640021f7cae400</tns:nodeId>
      <tns:interfaceEntry>
        <tns:port>26</tns:port>
        <tns:remoteNodeId>213109</tns:remoteNodeId>
        <tns:remotePort>38</tns:remotePort>
        <tns:remoteNodeId>134a34</tns:remoteNodeId>
        <tns:remotePort>2</tns:remotePort>
      </tns:interfaceEntry>
      <tns:interfaceEntry>
        <tns:port>28</tns:port>
      </tns:interfaceEntry>
      <tns:flowSpaceEntry>
      	<tns:policy>0</tns:policy>
      	<tns:port>32</tns:port>
      	<tns:dl_type>2</tns:dl_type>
      	<tns:tp_dst>423</tns:tp_dst>
      </tns:flowSpaceEntry>
      <tns:flowSpaceEntry>
      	<tns:policy>0</tns:policy>
      	<tns:port>1232</tns:port>
      	<tns:dl_dst>122</tns:dl_dst>
      	<tns:tp_src>4233</tns:tp_src>
      </tns:flowSpaceEntry>
    </tns:node>
  </tns:switchEntry>

  <tns:switchEntry>
    <tns:node>
      <tns:nodeId>2580021f7cae400</tns:nodeId>
      <tns:interfaceEntry>
        <tns:port>46</tns:port>
      </tns:interfaceEntry>
      <tns:interfaceEntry>
        <tns:port>48</tns:port>
      </tns:interfaceEntry>
    </tns:node>
  </tns:switchEntry>

  <tns:switchEntry>
    <tns:node>
      <tns:nodeId>1f40021f7cae400</tns:nodeId>
      <tns:interfaceEntry>
        <tns:port>41</tns:port>
      </tns:interfaceEntry>
      <tns:interfaceEntry>
        <tns:port>43</tns:port>
      </tns:interfaceEntry>
      <tns:interfaceEntry>
        <tns:port>44</tns:port>
      </tns:interfaceEntry>
    </tns:node>
  </tns:switchEntry>

  <tns:switchEntry>
    <tns:node>
      <tns:nodeId>1900021f7cae400</tns:nodeId>
    </tns:node>
  </tns:switchEntry>

  <tns:switchEntry>
    <tns:node>
      <tns:nodeId>12c0021f7cae400</tns:nodeId>
      <tns:interfaceEntry>
        <tns:port>33</tns:port>
      </tns:interfaceEntry>
      <tns:interfaceEntry>
        <tns:port>35</tns:port>
      </tns:interfaceEntry>
      <tns:interfaceEntry>
        <tns:port>36</tns:port>
      </tns:interfaceEntry>
    </tns:node>
  </tns:switchEntry>

  <tns:switchEntry>
    <tns:node>
      <tns:nodeId>c80021f7cae400</tns:nodeId>
    </tns:node>
  </tns:switchEntry>

  <tns:switchEntry>
    <tns:node>
      <tns:nodeId>123456789ab</tns:nodeId>
      <tns:interfaceEntry>
        <tns:port>0</tns:port>
      </tns:interfaceEntry>
      <tns:interfaceEntry>
        <tns:port>1</tns:port>
      </tns:interfaceEntry>
      <tns:interfaceEntry>
        <tns:port>2</tns:port>
      </tns:interfaceEntry>
      <tns:interfaceEntry>
        <tns:port>3</tns:port>
      </tns:interfaceEntry>
      <tns:interfaceEntry>
        <tns:port>4</tns:port>
      </tns:interfaceEntry>
      <tns:interfaceEntry>
        <tns:port>5</tns:port>
      </tns:interfaceEntry>
      <tns:interfaceEntry>
        <tns:port>6</tns:port>
      </tns:interfaceEntry>
      <tns:interfaceEntry>
        <tns:port>7</tns:port>
      </tns:interfaceEntry>
      <tns:interfaceEntry>
        <tns:port>8</tns:port>
      </tns:interfaceEntry>
      <tns:interfaceEntry>
        <tns:port>9</tns:port>
      </tns:interfaceEntry>
      <tns:interfaceEntry>
        <tns:port>10</tns:port>
      </tns:interfaceEntry>
      <tns:interfaceEntry>
        <tns:port>11</tns:port>
      </tns:interfaceEntry>
      <tns:interfaceEntry>
        <tns:port>12</tns:port>
      </tns:interfaceEntry>
      <tns:interfaceEntry>
        <tns:port>13</tns:port>
      </tns:interfaceEntry>
      <tns:interfaceEntry>
        <tns:port>14</tns:port>
      </tns:interfaceEntry>
    </tns:node>
  </tns:switchEntry>

</tns:RSpec>
